{
  "schema": "vitko.help/v1",
  "cli": {
    "name": "vitko",
    "version": "dev"
  },
  "scope": "runners estimate",
  "output": {
    "modes": [
      "text",
      "json",
      "ndjson"
    ],
    "default_on_terminal": "text",
    "default_not_on_terminal": "json",
    "env": "VITKO_OUTPUT",
    "errors_on": "stderr",
    "error_schema": "vitko.error/v1",
    "interactive": false,
    "schema_id_pattern": "vitko[.<product>].<type>/v<N>",
    "notes": [
      "stdout carries only the result document; diagnostics and errors go to stderr.",
      "Every JSON document has a \"schema\" field. New fields may appear without a version change; a breaking change bumps the version.",
      "Enums are open: handle values you don't know.",
      "Money is in integer micros of USD (1 USD = 1,000,000 micros), with a \"currency\" field.",
      "Unknown values are null, with a *_unavailable_reason field, never 0.",
      "vitko never prompts. Missing input is a usage error (exit code 2)."
    ]
  },
  "exit_codes": [
    {
      "code": 0,
      "meaning": "Success."
    },
    {
      "code": 1,
      "meaning": "Unexpected failure. Please report it."
    },
    {
      "code": 2,
      "meaning": "Usage: a bad flag or argument, missing input, or a required tool is missing."
    },
    {
      "code": 3,
      "meaning": "Not signed in, or the sign-in expired."
    },
    {
      "code": 4,
      "meaning": "Signed in but not allowed."
    },
    {
      "code": 5,
      "meaning": "Not found, or not visible to you."
    },
    {
      "code": 6,
      "meaning": "Conflict with the current state, for example a branch that already exists or a stale revision."
    },
    {
      "code": 7,
      "meaning": "A spend or concurrency limit, or its ceiling, stopped it."
    },
    {
      "code": 8,
      "meaning": "Temporarily unavailable or rate limited. Safe to retry."
    },
    {
      "code": 10,
      "meaning": "--check: changes would be made."
    }
  ],
  "error_codes": [
    {
      "code": "access_denied",
      "exit_code": 4,
      "meaning": "The sign-in was denied in the browser."
    },
    {
      "code": "branch_exists",
      "exit_code": 6,
      "meaning": "The branch for the pull request already exists."
    },
    {
      "code": "ceiling_not_set",
      "exit_code": 7,
      "meaning": "No ceiling is set, so tokens can only lower the limit."
    },
    {
      "code": "expired_token",
      "exit_code": 3,
      "meaning": "The sign-in code expired before it was approved."
    },
    {
      "code": "file_not_found",
      "exit_code": 5,
      "meaning": "A file or directory doesn't exist."
    },
    {
      "code": "forbidden",
      "exit_code": 4,
      "meaning": "Not allowed."
    },
    {
      "code": "fresh_sign_in_required",
      "exit_code": 4,
      "meaning": "This needs a sign-in from the last 12 hours."
    },
    {
      "code": "github_forbidden",
      "exit_code": 4,
      "meaning": "GitHub refused the request for this account."
    },
    {
      "code": "github_not_found",
      "exit_code": 5,
      "meaning": "GitHub has no such organization or repository, or it isn't visible to you."
    },
    {
      "code": "github_signed_out",
      "exit_code": 3,
      "meaning": "The GitHub CLI (gh) isn't signed in."
    },
    {
      "code": "github_unavailable",
      "exit_code": 8,
      "meaning": "GitHub didn't answer. Safe to retry."
    },
    {
      "code": "human_session_required",
      "exit_code": 4,
      "meaning": "Only an organization admin, signed in, can do this."
    },
    {
      "code": "input_required",
      "exit_code": 2,
      "meaning": "A required argument or flag is missing."
    },
    {
      "code": "internal",
      "exit_code": 1,
      "meaning": "An unexpected failure."
    },
    {
      "code": "invalid_input",
      "exit_code": 2,
      "meaning": "An input file or value couldn't be read."
    },
    {
      "code": "limit_above_ceiling",
      "exit_code": 7,
      "meaning": "The value is above the organization's ceiling."
    },
    {
      "code": "not_a_git_repository",
      "exit_code": 5,
      "meaning": "The path isn't inside a git repository."
    },
    {
      "code": "not_found",
      "exit_code": 5,
      "meaning": "Not found, or not visible to you."
    },
    {
      "code": "plugin_not_installed",
      "exit_code": 5,
      "meaning": "The helper program for this command isn't installed here."
    },
    {
      "code": "revision_conflict",
      "exit_code": 6,
      "meaning": "The resource changed since the revision given."
    },
    {
      "code": "schema_not_found",
      "exit_code": 5,
      "meaning": "No schema has that id."
    },
    {
      "code": "scope_missing",
      "exit_code": 4,
      "meaning": "The credential lacks the scope this needs."
    },
    {
      "code": "signed_out",
      "exit_code": 3,
      "meaning": "Not signed in to Vitko."
    },
    {
      "code": "token_expired",
      "exit_code": 3,
      "meaning": "The sign-in or token has expired."
    },
    {
      "code": "token_invalid",
      "exit_code": 3,
      "meaning": "The token isn't valid (revoked, expired or mistyped)."
    },
    {
      "code": "tool_missing",
      "exit_code": 2,
      "meaning": "A program this command needs (git or gh) isn't installed."
    },
    {
      "code": "unavailable",
      "exit_code": 8,
      "meaning": "The Vitko API is unavailable. Safe to retry."
    },
    {
      "code": "unknown_command",
      "exit_code": 2,
      "meaning": "No such command."
    },
    {
      "code": "usage",
      "exit_code": 2,
      "meaning": "A flag or argument is wrong."
    }
  ],
  "global_flags": [
    {
      "name": "output",
      "type": "string",
      "enum": [
        "text",
        "json",
        "ndjson"
      ],
      "env": "VITKO_OUTPUT",
      "summary": "Output format. Default: text on a terminal, json otherwise."
    },
    {
      "name": "json",
      "type": "boolean",
      "summary": "Same as --output json."
    },
    {
      "name": "fields",
      "type": "string[]",
      "summary": "Keep only these fields in JSON output (comma-separated, dotted paths such as months.month). Implies --output json."
    },
    {
      "name": "help",
      "type": "boolean",
      "summary": "Show help for the command. With --json, as JSON."
    }
  ],
  "commands": [
    {
      "path": "runners estimate",
      "summary": "Estimate what your GitHub Actions usage would cost on Vitko Runners.",
      "description": "Reads GitHub's usage report and prices the Linux x64 minutes at the Vitko list price, next to what GitHub charged. It runs on your machine: the report is never uploaded.\nGet the report from GitHub: Settings > Billing and licensing > Usage > Get usage report (the summarized report is enough). Or pass --from-github to fetch it with the GitHub CLI (needs an organization owner or billing manager).\nEach month gets its own free minutes. The result is an upper bound, because GitHub rounds each job up to whole minutes and Vitko bills per second.",
      "args": [
        {
          "name": "file",
          "summary": "GitHub usage report: the CSV, or the JSON from the billing usage API. Several files are fine.",
          "required": false,
          "variadic": true
        }
      ],
      "flags": [
        {
          "name": "from-github",
          "type": "string",
          "summary": "Fetch the usage of this GitHub organization with the GitHub CLI (gh) instead of reading files."
        },
        {
          "name": "month",
          "type": "string[]",
          "summary": "With --from-github: the month(s) to fetch. Default: last month."
        },
        {
          "name": "by-repo",
          "type": "boolean",
          "summary": "Also list Linux x64 minutes per repository."
        },
        {
          "name": "per-second-factor",
          "type": "number",
          "default": 1,
          "summary": "Illustrative ratio of per-second time to GitHub's rounded minutes, in (0, 1]. 1 is the upper bound."
        }
      ],
      "mutates": false,
      "idempotent": true,
      "dry_run": false,
      "network": true,
      "scopes": [],
      "output_schema": "vitko.runners.estimate/v1",
      "errors": [
        "usage",
        "internal",
        "input_required",
        "invalid_input",
        "file_not_found",
        "tool_missing",
        "github_signed_out",
        "github_forbidden",
        "github_not_found",
        "github_unavailable"
      ],
      "examples": [
        "vitko runners estimate usage-report.csv",
        "vitko runners estimate usage-2026-08.csv usage-2026-09.csv --by-repo",
        "vitko runners estimate --from-github my-org --month 2026-08 --month 2026-09"
      ],
      "plugin": false
    }
  ]
}
